paperId,title
358,Employing artificial neural networks for constructing metadata-based model to automatically select an appropriate data visualization technique
359,Bayes e o Spam
360,Complexidade de Algoritmos
361,Recommender systems in e-learning environments - a survey of the state-of-the-art and possible extensions.
362,Raciocinio
363,Big data: The next frontier for innovation  competition  and productivity
364,Metadata Principles and Practicalities
365,m-LOCO: An ontology-based framework for context-aware mobile learning
366,Prot{\'e}g{\'e} OWL Tutorial
367,Detecting global and local topics via mining twitter data
368,The elements of statistical learning: data mining  inference and prediction
369,Interlinking educational resources and the web of data: A survey of challenges and approaches
370,CLASSIC: A structural data model for objects
371,A Survey Paper on Recommender Systems
372,Making the Grade with Educational Technology: Digital learing environments transform both learning and teaching
373,In search of computer-aided social support in non-communicable diseases care
374,Let's Meet: Integrating Social and Learning Worlds
375,10.1.1.100.8873
376,Factorization techniques for predicting student performance
377,https://circle.ubc.ca/bitstream/handle/2429/44812/Castagne_Michel_LIBR596_IR_comparison_2013.pdf?sequence=1
378,Peertrust: Automated trust negotiation for peers on the semantic web
379,L{\'o}gica para Computa{\c c}{\~a}o
380,Measuring aesthetic distance between document templates and instances
381,A novel mobile recommender system for indoor shopping
382,L{\'o}gica para Computa{\c c}{\~a}o
383,Recommender system application developments: A survey
384,Android fine-grained permission control system with real-time expert recommendations
385,The Semantic Web Vision: Where Are We?
386,Letizia: An Agent That Assists Web Browsing
387,A recommender agent based on learning styles for better virtual collaborative learning experiences
388,STEM: Good Jobs Now and for the Future. ESA Issue Brief {\#}03-11.
389,An architecture for a multiagent recommender system in travel recommendation scenarios
390,Ridership effects of real-time bus information system: A case study in the City of Chicago
391,Comparing State-of-the-Art Collaborative Filtering Systems
392,Web Sem{\^a}ntica: a Internet do Futuro
393,Proposing a new friend recommendation method  FRUTAI  to enhance social media providers' performance
394,Linked education: interlinking educational resources and the Web of data.
395,Beyond Recommender Systems: Helping People Help Each Other
396,Towards a sociological view of trust in computer science
397,A survey of trust and reputation systems for online service provision.
398,Cogni{\c c}{\~a}o: Compreendendo a per{\'\i}cia
399,The MATHESIS Ontology: Reusable Authoring Knowledge for Reusable Intelligent Tutors
400,https://circle.ubc.ca/bitstream/handle/2429/44812/Castagne_Michel_LIBR596_IR_comparison_2013.pdf?sequence=1
401,The formation of trust and distrust in recommendation agents in repeated interactions: a process-tracing analysis
402,Microsoft Word - kdeidxdone06.doc
403,Personal recommender systems for learners in lifelong learning networks\{\&}\{\#}58; the requirements  techniques and model
404,Web services-what do they mean to Web-based education?
405,Introduction: culture-bound syndromes.
406,Constraint-based recommender systems: technologies and research issues
407,Distributed Credential Chain Discovery in Trust Management with Parameterized Roles and Constraints
408,MoBiDiCk: Uma ferramenta para computa{\c c}{\~a}o distribu{\'\i}da na internet
409,Data Portability with SIOC and FOAF
410,Ausblick auf Bibliotheken im Jahr 2027 - Keytrends aus dem NMC Horizon Report 2017 Library Edition weiter gedacht
411,Not quite the average: An empirical study of Web use
412,Description logics in data management
413,Manifesto for the Reputation Society
414,Revis\{\textasciitilde}ao de Conceitos
415,MARGOT: A web server for argumentation mining
416,Handbook on Information Technologies for Education and Training
417,User data discovery and aggregation: The CS-UDD algorithm
418,Filtering Technique on Mobile Cloud Computing
419,Big data: How do your data grow?
420,Recommending Travel Packages Upon Distributed Knowledge
421,Response of electric vehicle drivers to dynamic pricing of parking and charging services: Risky choice in early reservations
422,Review on Computational Trust and Reputation Models
423,L{\'o}gica para Computa{\c c}{\~a}o
424,An overview of planning under uncertainty
425,Developing distributed intelligent learning environment with JADE{\textemdash}Java Agents for Distance Education Framework
426,Improving recommender systems with adaptive conversational strategies
427,Documenting Visual Quality Controls on the Evaluation of Petroleum Reservoir-rocks through Ontology-based Image Annotation
428,Personalization of Supermarket Product Recommendations
429,L{\'o}gica para Computa{\c c}{\~a}o
430,Perspectives on multiagent learning
431,Rank order-based recommendation approach for multiple featured products
432,When is a Learning Object not an Object: A first step towards a theory of learning objects
433,Contents
434,Identifying topical authorities in microblogs
435,Social Information Filtering: Algorithms for Automating ``Word of Mouth''
436,Engenharia de Conhecimento
437,New approaches in teaching medical informatics to medical students
438,Creating effective student engagement in online courses: What do students find engaging?
439,Hybrid Recommender Systems for Electronic Commerce
440,Identifying the Goal   User model and Conditions of Recommender Systems for Formal and Informal Learning
441,BDI models and systems: Bridging the gap
442,Title
443,Collaborative analysis model for trending images on social networks
444,X-BDI: uma ferramenta para programa\\cc\\\{\textasciitilde}a\o de agentes BDI
445,Rethinking the recommender research ecosystem: reproducibility  openness  and LensKit
446,Mining big data: current status  and forecast to the future
447,The Semantic Web Roadmap
448,Recommendation systems for software engineering
449,Heterogeneous Network Linkage-weight Based Link Prediction in Bipartite Graph for Personalized Recommendation
450,Six Provocations for Big Data
451,Multi-model Ontology-Based Hybrid Recommender System in E-learning Domain
452,Learning Technologies Standards Observatory
453,A distributed trust model
454,Using the beliefs of self-efficacy to improve the effectiveness of ITS: an empirical study
455,Multi-agent learning for engineers
456,A Survey of Trust in Internet Applications
457,Distributed credential chain discovery in trust management with parameterized roles and constraints (short paper)
458,Problemas em NP
459,Using Ontology Engineering Methods to Improve Computer Science and Data Science Skills
460,Introdu{\c c}{\~a}o {\`a} Aprendizagem Profunda
461,Wikipedia
462,User modeling via stereotypes
463,Formal analysis of the communication of probabilistic knowledge
464,Ontology-Based User Context Management: The Challenges of Imperfection and Time-Dependence
465,Applications  Reliability  and Validity of the Index of Learning Styles
466,Fast Recommendations using GAI Models
467,Collaborative groups in a medical learning environment
468,Tecnologias de SW livre para an{\'a}lise de mensagens em chats e recomenda{\c c}{\~o}es online de documentos eletr{\^o}nicos
469,Informed Recommender: Basing Recommendations on Consumer Product Reviews
470,Making the most of information technology {\&}amp; systems usage: A literature review  framework and future research agenda
471,Discovering users' topics of interest on twitter: a first look
472,L{\'o}gica para Computa{\c c}{\~a}o
473,MovieLens unplugged: experiences with an occasionally connected recommender system
474,LNAI 4068 - Ontological Constitutions for Classes and Properties
475,Research directions on Semantic Web and education
476,MX Logic Reports Spam Accounts for 67 Percent of All Email in 2005
477,Report on the CONALD Workshop on Learning from Text and the Web
478,Print Markup Language functional specification version 2.1
479,Known evils: Common pitfalls of knowledge management
480,PACS through Web Compatible with DICOM Standard and WADO Service: Advantages and Implementation
481,A tag based learning approach to knowledge acquisition for constructing prior knowledge and enhancing student reading comprehension
482,Ontologies in amine platform: Structures and processes
483,Exploring the effects of specialist versus generalist embodied virtual agents in a multi-product category online store
484,Like an intuitive and courteous butler: a proactive personal agent for task management
485,Using Collaborative Filtering to Weave an Information Tapestry.
486,A framework for collaborative  content-based and demographic filtering
487,Utilizing various sparsity measures for enhancing accuracy of collaborative recommender systems based on local and global similarities
488,Extending SCORM LOM
489,Pensamento Computacional no Ensino de Programa{\c c}{\~a}o: Uma Revis{\~a}o Sistem{\'a}tica da Literatura Brasileira
490,Common Logic In Support of Metadata and Ontologies
491,The future university: Ideas and possibilities
492,Property-based collaborative filtering: A new paradigm for semantics-based  health-aware recommender systems
493,Congestion games with malicious players
494,Understanding and improving automated collaborative filtering systems
495,UNIVERSIDADE DE S{\~A}O PAULO
496,A computational model of trust and reputation
497,Semantic web technologies applied to interoperability on an educational portal
498,Applying neural networks to knowledge representation and determination of its meaning
499,Strategies for document optimization in digital publishing
500,Exchanging Reputation Information between Communities: A Payment-Function Approach
501,FEB
502,Arquiteturas de Sistemas Tutores Inteligentes
503,Digital Libraries: Universal and {\ldots}
504,An overview of knowledge representation
505,Nash Q-learning for general-sum stochastic games
506,An Architecture for an Intelligent Learning Environment with a constructivist approach
507,Educa{\c c}{\~a}o Musical auxiliada por computador: algumas considera{\c c}{\~o}es e experi{\^e}ncias
508,Handheld use in K-12: a descriptive account
509,Como fazer uma tese (1)
510,Towards flexible learning object metadata
511,Casamento aproximado de dados e esquemas
512,MovieLens
513,The Kerberos Network Authentication Service RFC 4120
514,A Web-based automotive refrigeration troubleshooting system applying knowledge engineering approach
515,Ontology-based automatic annotation of learning content
516,An Integration of Reputation-based and Policy-based Trust Management
517,Perceived outcomes of public libraries
518,Extending web-based educational systems with personalised support through User Centred Designed recommendations along the e-learning life cycle
519,What data and analytics can and do say about effective learning
520,Mobile wellness application-seeking behavior by college students{\textemdash}An exploratory study
521,On-to-knowledge methodology (OTKM)
522,Deliberation process in a BDI model with Bayesian networks
523,Uma Ontologia Temporal para Modelagem de Conhecimento sobre Ordena{\c c}{\~a}o de Eventos
524,A Way How to Impart Data Science Skills to Computer Science Students Exemplified by OBDA-Systems Development
525,Towards a DL-Based Semantic User Model for Web Personalization
526,Usability testing of existing type 2 diabetes mellitus websites
527,Improving case-based recommendation: A collaborative filtering approach
528,OntoShare - An Ontology-based Knowledge Sharing System for virtual Communities of Practice
529,Semantics for the Jason Variant of AgentSpeak
530,T{\'e}cnicas de Aquisi{\c c}{\~a}o de Conhecimento para Sistemas Baseados em Conhecimento
531,Essentials of game theory
532,FR: A Recommender for Finding Faculty Based on CF Technique
533,Learning collaborative information filters
534,Web Services Architecture
535,Cognitive engagement in the problem-based learning classroom
536,Data-intensive applications  challenges  techniques and technologies: A survey on Big Data
537,\emph{Quality Ontology for Recommendation in an Adaptive Educational System}
538,Foundations of Semantic Web Technologies
539,Description Logics
540,The relationship between classroom quality and students{\textquoteright} engagement in secondary school
541,Recommender Systems An Introduction
542,2017 NMC Technology Outlook> Nordic Schools at a Glance
543,Personalization and Context-awareness in Social Local Search: State-of-the-art and Future Research Challenges
544,Text mining: The state of the art and the challenges
545,ccREL: The Creative Commons Rights Expression Language
546,Similaridade de Series Temporais na Bolsa de Valores
547,SMARTMUSEUM: A mobile recommender system for the Web of Data
548,Social networks for improving healthy weight loss behaviors for overweight and obese adults: A randomized clinical trial of the social pounds off digitally (Social POD) mobile app
549,AWESOME: A general multiagent learning algorithm that converges in self-play and learns a best response against stationary opponents
550,Matching entities across online social networks
551,Information Storage and Retrieval Systems
552,T\'ecnicas de aquisi\cc\{\textasciitilde}ao de conhecimento para sistemas baseados em conhecimento
553,Using affective parameters in a content-based recommender system for images
554,Data mining in educational technology classroom research: Can it make a contribution?
555,Benchmarking OWL reasoners
556,When the Domain of the Ontology is Education
557,Ontological content-based filtering for personalised newspapers: A method and its evaluation
558,Knowledge Engineering: Principles and Methods
559,￼Definitions of Ontology - First Part: from Christian Wolff to Edmund Husserl
560,Understanding and Using Context
561,Description logics for an autonomic IDS event analysis system
562,Agentes Inteligentes
563,Using latent topics to enhance search and recommendation in Enterprise Social Software
564,Prova Brasil
565,Collaborative recommendation of e-learning resources: an experimental investigation
566,TiVo: making show recommendations using a distributed collaborative filtering architecture
567,Perspectives on multiagent learning
568,Semantic Web Languages for Policy Representation and Reasoning: A Comparison of KAoS  Rei  and Ponder
569,Towards ontology engineering
570,Application Profiles: Mixing and Matching Metadata Schemas
571,Golden Ratio
572,Software Engineering  8/E
573,Competence models in technology-enhanced competence-based learning
574,Desenvolvimento do Racioc{\'\i}nio L{\'o}gico e Algoritmo Atrav{\'e}s do Programa Institucional de Bolsas de Inicia{\c c}{\~a}o {\`a} Doc{\^e}ncia no Ensino Fundamental
575,Ontology-based Framework for User Model Interoperability in Distributed Learning Environments
576,Use of blogs in pre-service teacher education to improve student engagement
577,Knowledge Representation and Reasoning
578,Shilling recommender systems for fun and profit
579,Extensible Stylesheet Language (XSL) Version 1.1
580,Collaborative Filtering by Personality Diagnosis: A Hybrid Memory- and Model-based Approach
581,The Development of Intelligent Learning Objects with an Ontology based on SCORM Standard
582,Abc da impress{\quotedblbase}o digital de dados vari{\textperiodcentered}veis - parte 1.
583,On Modeling and Simulation of Game Theory-based Defense Mechanisms against DoS and DDoS Attacks
584,An IEEE LOM application profile to describe training resources for agricultural {\&} rural SMEs
585,An overview of spam blocking techniques
586,Supporting social recommendations with activity-balanced clustering
587,User data distributed on the social web
588,Metodologia Common KADS
589,Learning and revising user profiles: The identification of interesting web sites
590,LNAI 1867 - Ontology  Metadata  and Semiotics
591,Redes bayesianas
592,Effectiveness of Different Recommender Algorithms in the Mobile Internet: A Case Study
593,Data mining in educational technology classroom research: Can it make a contribution?
594,Event ordering reasoning ontology applied to petrology and geological modelling
595,Social Agents to Improve Collaboration on an Educational Portal
596,Data Mining of User Navigation Patterns
597,5 - Big data collecting
598,COMP4418 : Knowledge Representation and Reasoning Belief Revision Belief Change {\textemdash} An example Belief Change {\textemdash} An example Belief Change {\textemdash} An example Belief Change {\textemdash} The General Idea
599,Accountability in education: meeting our commitments
600,GroupLens: an open architecture for collaborative filtering of netnews
601,Learning to ask the right questions to help a learner learn
602,Expressiveness and tractability in knowledge representation and reasoning
603,Logic-based knowledge representation
604,Case-based reasoning foundations
605,Programming agents with Jason
606,Individual Q-learning in normal form games
607,Utilizing Relevant Academic and Personality Features from Big Unstructured Data to Identify Good and Bad Fit Students
608,Semantic Web Recommender System Based Personalization Service for User XQuery Pattern
609,Building recommender systems using a knowledge base of product semantics
610,Colabora{\c c}{\~a}o em Ambientes Inteligentes de Aprendizagem mediada por um Agente Social Probabil{\'\i}stico
611,Emerging Trends in Information and Communication Security  International Conference  ETRICS 2006  Freiburg  Germany  June 6-9  2006  Proceedings
612,Plano de Atividades para Est {\textasciiacute} agio Probat {\textasciiacute} orio Introdu {\c\} c {\~{ }} ao Ensino Pesquisa
613,A computational model of distance learning based on Vygotsky's socio-cultural approach
614,Systematic Mapping Studies in Software Engineering.
615,A BDI approach to infer student's emotions in an intelligent learning environment
616,Improving Interactivity in e-Learning Systems with Multi-agent Architecture
617,Dropout rates of massive open online courses : behavioural patterns
618,Ontologia baseada em Objetos de Aprendizagem na defini{\c c}{\~a}o de Conte{\'u}dos de uma Rede Social Acad{\^e}mica
619,Information extraction for knowledge base construction in the music domain
620,Fundamentals of Multiagent Systems: Using NetLogo Models
621,Assumption-Based Reasoning for Multiagent Case-Based Recommender Systems
622,Adding a trust layer to semantic web metadata
623,Knowledge-based Estimation of Manufacturing Lead Time for Complex Engineered-to-order Products
624,Ownership versus on-campus use of mobile IT devices by university students
625,An Introduction to MultiAgent Systems - Introduction
626,Intellectual capital: the new wealth of organizations
627,Classes de complexidade De P at\'e ELEMENTAR G A significado do P = NP
628,Multi-agent learning for engineers
629,eqnet.eun.org/c/document_library/get_file?folderId=12421{\&}name=DLFE-304.pdf
630,DPFCM: A novel distributed picture fuzzy clustering method on picture fuzzy sets
631,A Survey of E-Commerce Recommender Systems
632,Knowledge Modelling for a Hotel Recommendation System
633,Proceedings of the 20th Brazilian conference on Advances in artificial intelligence
634,Material de Jason
635,Practice research partnerships in social work
636,User credit-based collaborative filtering
637,Intelligent Virtual Agents  7th International Conference  IVA 2007  Paris  France  September 17-19  2007  Proceedings
638,L{\'o}gica para Computa{\c c}{\~a}o
639,Complexidade de Algoritmos
640,Simulating Light-Weight Personalised Recommender Systems in Learning Networks:   a Case for Pedagogy-Oriented and Rating-Based Hybrid Recommendation Strategies
641,Collaborative Filtering Using Dual Information Sources
642,2010 International Conference on Multimedia Information Networking and Security
643,Autodesenvolvimento e Compet{\^e}ncias: O caso do Trabalhador de Conhecimento como Especialista
644,Expert or peer? Understanding the implications of virtual advisor identity on emergency rescuer empowerment in mobile psychological self-help services
645,An intelligent movie recommendation system through group-level sentiment analysis in microblogs
646,The role of geo-based technology in place experiences
647,A Structured Evaluation to Assess the Reusability of Models of User Profiles
648,Engineering Semantic Web Information Systems
649,Rumo ao Uso de Metadados Educacionais em Sistemas de Recomenda{\c c}{\~a}o
650,New Recommendation Techniques for Multicriteria Rating Systems
651,Automatically producing IMS AccessForAll Metadata
652,Projeto OBAA: Uma abordagem com objetos de aprendizagem interoper{\'a}veis baseados na web e na televis{\~a}o digital
653,Comparing state-of-the-art collaborative filtering systems
654,Nash Q-learning for general-sum stochastic games
655,Dublin Core Metadata Initiative - Abstract Model
656,Improving CBR adaptation for recommendation of associated references in a knowledge-based learning assistant system
657,A. R. C. A digital library resources Web site
658,Preface
659,Big data reduction framework for value creation in sustainable enterprises
660,irbookprint.pdf
661,IJCAI 2009  Proceedings of the 21st International Joint Conference on Artificial Intelligence  Pasadena  California  USA  July 11-17  2009
662,Geographical recommender system based on interaction between map operation and category selection
663,Aesthetic measures for automated document layout
664,Proposta para Ensino da Mat{\'e}ria de Intelig{\^e}ncia Artificial em Cursos de Gradua{\c c}{\~
665,3D Hierarchies for Animation
666,Description logics
667,Semantic Networks and Description Logics - Introduction
668,MOVIES2GO: an online voting based movie recommender system
669,An integrated system to assist personalized learning based on gradual adaption recommendation model
670,Evolutionary fine-tuning of automated semantic annotation systems
671,Knowledge Containers
672,Architectural design of a multi-agent recommender system for the legal domain
673,Understanding  building  and using ontologies: A commentary to
674,Event ordering reasoning ontology applied to petrology and geological modelling
675,LC-Lecture6
676,Avoiding Fake Neighborhoods in e-Commerce Collaborative Recommender Systems: A Semantic Approach
677,Let's Meet: Integrating Social and Learning Worlds
678,Sweetening ontologies with DOLCE
679,A survey on context-aware systems
680,Towards High-Dimensional Clustering
681,An Adaptive Match-Making System reflecting the explicit and implicit preferences of users
682,Trust-aware decentralized Recommender Systems
683,Semantically enhanced Information Retrieval: An ontology-based approach
684,An index to quantify an individual's scientific research output
685,Definindo Conhecimento
686,Development of a reading material recommendation system based on a knowledge engineering approach
687,Contents
688,Machine Learning for Adaptive Power Management
689,What Forty Years of Research Says About the Impact of Technology on Learning A Second-Order Meta-Analysis and Validation Study
690,Elicitation{\textemdash}Extracting Knowledge from Experts
691,NMC horizon report: 2017 higher education edition
692,Data Mining: Concepts and Techniques
693,Sharing Biomedical Learning Knowledge for Social Ambient Intelligence
694,A survey on game theory applications in wireless networks
695,Using collaborative filtering to support college students{\textquoteright} use of online forum for English learning
696,News\W\eeder: learning to filter netnews
697,Educational data mining: A survey and a data mining-based analysis of recent works
698,Towards learning user-adaptive state models in a conversational recommender system
699,E-Learning as a Web Service. 
700,The formation of trust and distrust in recommendation agents in repeated interactions: a process-tracing analysis
701,Multiagent systems
702,E-Learning Personalization Based on Hybrid Recommendation Strategy and Learning Style identification
703,Predictions for 2009
704,Towards semantic metadata for learning elements
705,Amazon
706,On recommendation problems beyond points of interest
707,Web 3.0 has begun
708,Introduction to Linked Data and Its Lifecycle on the Web
709,An investigation of the levels of abstraction of tags across three resource genres
710,What is a knowledge representation?
711,Sistemas operacionais modernos
712,Towards Enabling Web 2.0 Content Sharing beyond Walled Gardens
713,Paradox of the active user
714,An Introduction to MultiAgent Systems - Deductive Reasoning Agents
715,DBpedia - A crystallization point for the Web of Data
716,Some challenges for context-aware recommender systems
717,Making agents acceptable to people abstract of a key-note speech
718,Introduction to Semantic Networks and Description Logics
719,Recommender system for predicting student performance
720,Amazon.com Recommendations: Item-to-Item Collaborative Filtering
721,:: revista TELOS :: Dossier :: Creativity  Innovation and Digital Culture. A Map of Interactions
722,A survey on context-aware systems
723,Ontologia Ontologias
724,Metadata for Learning Resources: An Update on Standards Activity for 2008
725,Personal recommender systems for learners in lifelong learning networks: the requirements  techniques and model
726,Ontological constitutions for classes and properties
727,Communications and multimedia security
728,Proceedings of the 2002 ACM CIKM International Conference on Information and Knowledge Management  McLean  VA  USA  November 4-9  2002
729,PISA 2015 Results (Volume V)
730,A day in the life of a genome biologist in the not-too-distant future
731,Current State of Agile User-Centered Design: A Survey
732,Wikipedia
733,Artificial Neural Network models for Data Mining tasks in Bioinformatics
734,Recomenda{\c c}{\~a}o de Web Services para auxiliar a composi{\c c}{\~a}o
735,Smart Space based Recommendation Service for Historical Tourism
