paperId,title
1,Desenvolvendo um Sistema de Recomenda{\c c}{\~a}o de Objetos de Aprendizagem baseado em Compet{\^e}ncias para a Educa{\c c}{\~a}o: relato de experi{\^e}ncias
2,Recommender systems in technology enhanced learning
3,A \K\-Means Clustering Algorithm
4,What is an Ontology?
5,The Role of Trust and Deception in Virtual Societies
6,Sharing a Secret: How Kerberos Works
7,Using trust in recommender systems: an experimental analysis
8,What drives a successful e-Learning? An empirical investigation of the critical factors influencing learner satisfaction
9,Constructionist Design Methodology for Interactive Intelligences
10,A knowledge and collaboration-based CBR process to improve network performance-related support activities
11,2009 Annual Computer Security Applications Conference
12,Three-Layer OWL Ontology Design.
13,Codes: a web-based environment for cooperative music prototyping
14,Personalized Ontology-Based Recommender Systems for Multimedia Objects
15,Morphologically normal spermatozoa of patients with secretory oligo-astheno-teratozoospermia have an increased aneuploidy rate
16,Ontologies and knowledge bases
17,iTravel: A recommender system in mobile peer-to-peer environment
18,Power to the patients: The HealthNetsocial network
19,Improving collaborative recommendation of coupons through Digital TV by semantic inference of users' reputation
20,A social network-empowered research analytics framework for project selection
21,Digital immigrant teachers and digital native students: What happens to teaching?
22,Completing LOM-how additional axioms increase the utility of learning object metadata
23,An{\'a}lise autom{\'a}tica de temas discutidos por chat em uma Comunidade Virtual
24,Complexidade de Algoritmos
25,Collaborative filtering adapted to recommender systems of e-learning
26,Retention and Intention in Massive Open Online Courses: In Depth
27,Title
28,AMPLIA Learning Environment Architecture
29,The Ponder Policy Specification Language
30,Proceedings of the 2011 iConference on - iConference '11
31,O M{\'e}todo Cient{\'\i}fico
32,When is a Learning Object not an Object: A first step towards a theory of learning objects
33,Ontologia - Especifica{\c c}{\~a}o Formal do Mundo
34,An Agile Method for Developing OERs and its Application in Serious Game Design
35,Knowledge Representation on the Semantic Web
36,The sharable content object reference model (SCORM) - a critical review
37,Digital Libraries and \Autonomous Citation Indexing\
38,The ontological identity of learning objects: an analysis proposal
39,Multidimensional analysis model for a document warehouse that includes textual measures
40,M\\'e\todos e T\\'e\cnicas de pesquisa: Tipos de pesquisa e t\\'e\cnicas de investiga\\cc\\\{\textasciitilde}a\o cient\\'\i\fica
41,Linked data-the story so far
42,Towards TV Recommender System: Experiments with User Modeling
43,Comparing and evaluating information retrieval algorithms for news recommendation
44,Internet  o que {\'e}  o que oferece  como conectar-se
45,Recommender Systems for Human Resources Task Assignment.
46,Semantics for the Jason Variant of AgentSpeak
47,An extended attribute based access control model with trust and privacy: Application to a collaborative crisis management system
48,Educational recommender systems and their application in lifelong learning
49,A collaborative filtering framework for friends recommendation in social networks based on interaction intensity and adaptive user similarity
50,Equilibrium points in n-person games
51,Recent trends in hierarchic document clustering: A critical review.
52,Distributed credential chain discovery in trust management with parameterized roles and constraints (short paper)
53,A survey of trust in internet applications
54,Run the GAMUT: A comprehensive approach to evaluating game-theoretic algorithms
55,Multiagent Q-Learning for Aloha-Like Spectrum Access in Cognitive Radio Systems
56,PHP
57,Effective solutions for real-world Stackelberg games: when agents must deal with human uncertainties
58,A Reference Profile Ontology for Communities of Practice
59,Towards Ontological Profiles in Communities of Practice
60,Login - Dropbox
61,Research on personalized recommendation system in E-learning
62,Recommending and evaluating choices in a virtual community of use
63,Building  sharing  and merging ontologies
64,Knowledge infusion: In pursuit of robustness in artificial intelligence
65,Recommender Systems for Learning
66,Desconstruindo Objetos de Aprendizagem: reflex{\~o}es sobre sua qualidade de uso
67,Using ontologies for modeling educational content
68,Taxonomy of mobile users' security awareness
69,Detecting potential collusive cliques in futures markets based on trading behaviors from real data
70,Evaluating collaborative filtering recommender systems
71,Equilibrium points in n-persons game
72,The Ponder Policy Specification Language
73,Digital Game-Based Learning in high school Computer Science education: Impact on educational effectiveness and student motivation
74,Information provision for challenging markets: The case of the accessibility requiring market in the context of tourism
75,A Case Study on Various Recommendation Systems
76,Uma Ontologia OWL para Metadados IEEE-LOM  Dublin-Core e OBAA
77,An Introduction to MultiAgent Systems - Intelligent Agents
78,The ethical and social implications of personalization technologies for e-learning
79,Mining affective text to improve social media item recommendation
80,Chandos Information Professional Series
81,Linked Data star scheme by example
82,Social  affective and pedagogical agents for the recommendation of student tutors
83,Trust and nuanced profile similarity in online social networks
84,Um Modelo de Conhecimento Baseado em Eventos para Aquisi{\c c}{\~a}o e Representa{\c c}{\~a}o de Seq{\"u}{\^e}ncias Temporais
85,Personalisation in web computing and informatics: Theories  techniques  applications  and future research
86,XII Ciclo de Cursos e Palestras da Engenharia El\'etrica - XI CIPEEL Conexionismo
87,Artificial Neural Network models for Data Mining Tasks in Bioinformatics
88,Elicitation of latent learning needs through learning goals recommendation
89,Subjectivity and sentiment analysis: An overview of the current state of the area and envisaged developments
90,Use a cabe{\c c}a
91,Recommender Systems for the Semantic Web
92,Detection of antibodies against Echinococcus granulosus major antigens and their subunits by immunoblotting
93,Facilitating Interoperability in Semantic Web Applications Using Ontologies
94,Advances in Conceptual Modeling - Foundations and Applications  ER 2007 Workshops CMLSA  FP-UML  ONISW  QoIS  RIGiM SeCoGIS  Auckland  New Zealand  November 5-9  2007  Proceedings
95,Web personalization: The state of the art and future avenues for research and practice
96,Research-paper recommender systems - a literature survey.
97,On exploiting classification taxonomies in recommender systems
98,Complexidade de Algoritmos
99,A Framework for Collaborative  Content-Based and Demographic Filtering
100,L{\'o}gica para Computa{\c c}{\~a}o
101,Effectiveness of different recommender algorithms in the Mobile Internet: A case study
102,Peirces Contributions to the 21 Century
103,An MIU [Most Influential Users]-Based Model for Recommender Systems.
104,Shaping how advertisers see me: user views on implicit and explicit profile capture
105,Predicting user personality by mining social interactions in Facebook
106,A User Reputation Model for DLDE Learning 2.0 Community
107,Advances in Web Based Learning - ICWL 2007  6th International Conference  Edinburgh  UK  August 15-17  2007  Revised Papers
108,Development of a group recommender application in a Social Network
109,Sistemas de Conhecimento: Aplica{\c c}{\~a}o e Desenvolvimento
110,Mecanismos para cria{\c c}{\~a}o de conte{\'u}do interoper{\'a}vel entre Web  TV Digital e M{\'o}veis
111,Mendeley's Reply to the DataTEL Challenge
112,LC-Lecture10
113,A survey on pervasive education
114,Transaction Agent Modelling: From Experts to Concepts to Multi-Agent Systems
115,Tagommenders: connecting users to items through tags
116,Designing a semantic bliki system to support different types of knowledge and adaptive learning
117,Uma Ontologia Temporal para Modelagem de Conhecimento sobre Ordena\cc\{\textasciitilde}ao de Eventos
118,Technological support for the enactment of collaborative scripted learning activities across multiple spatial locations
119,Comparison of reasoners for large ontologies in the OWL 2 EL profile
120,Personalized Course Generation Based on Layered Recommendation Systems
121,MovieLens
122,Personalized task recommendation in crowdsourcing information systems {\textemdash} Current state of the art
123,Item-based collaborative filtering recommendation algorithms
124,Ontology-based models in pervasive computing systems
125,Temporal Database Queries for Recommender System using Temporal Logic
126,An information retrieving service for distance learning
127,RDF triple processing methodology for the recommendation system using personal information
128,Anu{\'a}rio Brasileiro da Educa{\c c}{\~a}o B{\'a}sica
129,Institutional repository software comparison: DSpace  EPrints  Digital Commons  Islandora and Hydra
130,Bridging the gap between knowledge management and e-learning with context-aware corporate learning
131,PolyLens: a recommender system for groups of users
132,Perceived usefulness of innovative technology in retailing: Consumers׳ and retailers׳ point of view
133,Ontology development 101: A guide to creating your first ontology
134,Who does what in a massive open online course?
135,A recommender system based on tag and time information for social tagging systems
136,L{\'o}gica para Computa{\c c}{\~a}o
137,SAT Modeling and connection to CSP
138,Service-Oriented E-Learning Platforms: From Monolithic Systems to Flexible Services
139,Complexidade de Algoritmos
140,Being accurate is not enough: how accuracy metrics have hurt recommender systems
141,Understanding Semantic Web Applications
142,Active learning increases student performance in science  engineering  and mathematics
143,Improving Collaborative Filtering in Social Tagging Systems for the Recommendation of Scientific Articles
144,A framework for recommendation in learning object repositories: An example of application in civil engineering
145,The use of multi-agent systems to build intelligent tutoring systems
146,Variable Data Printing 2006: Growth and Changes in the Marketplace
147,Service quality explains why people use freemium services but not if they go premium: An empirical study in free-to-play games
148,Integration of Recommendations and Adaptive Hypermedia into Java Tutoring System
149,Evaluating the impact of proactivity in the user experience of a context-aware restaurant recommender for Android smartphones
150,Resumes {\&} Cover Letters
151,Toward principles for the design of ontologies used for knowledge sharing?
152,Brazilian Proposal for Agent-Based Learning Objects Metadata Standard-OBAA
153,Toward principles for the design of ontologies used for knowledge sharing
154,{\textquotedblleft}Antedisciplinary{\textquotedblright} Science
155,Mining social networks for anomalies: Methods and challenges
156,O Modelo do Conhecimento Primitivas do Modelo Componentes do Modelo
157,A Concise Introduction to Multiagent Systems and Distributed Artificial Intelligence
158,Context-aware collaborative filtering system: predicting the user's preferences in ubiquitous computing
159,Digital Information Strategies
160,Accounting for taste: using profile similarity to improve recommender systems
161,Developing a Recommendation Web Service for a Federation of Learning Repositories
162,Collaborative Information Filtering: A Review and an Educational Application
163,Construction of Engineering Ontologies for Knowledge Sharing and Reuse
164,Effective learning in the presence of adaptive counterparts
165,Current Issues in Multi-Agent Systems Development
166,Research on Several Recommendation Algorithms
167,Recent Research on Human Learning Challenges Conventional Instructional Strategies
168,CENSO ESCOLAR DA EDUCA{\c C}{\~A}O B{\'A}SICA 2012 RESUMO T{\'E}CNICO
169,MySQL
170,The NeOn Methodology for Ontology Engineering
171,Modelagem e implementa{\c c}{\~a}o da interface para apresenta{\c c}{\~a}o de comportamentos animados e emotivos de um agente pedag{\'o}gico animado
172,2005 Index IEEE Transactions on Knowledge and Data Engineering
173,Analyzing Web Chat Messages for Recommending Items from a Digital Library
174,Wikipedia
175,Learning to Recommend Product with the Content of Web Page
176,Mashup FOAF for Video Recommendation LightWeight Prototype
177,The impact of context on display ad effectiveness: Automatic attitude activation and applicability
178,Semantic annotation of video fragments as learning objects: a case study with YouTube videos and the Gene Ontology
179,Recommending research colloquia
180,Legal Ontologies in Knowledge Engineering and Information Management
181,GroupLens: An Open Architecture for Collaborative Filtering of Netnews
182,Probabilistic Robotics by Sebastian Thrun  Wolfram Burgard and Dieter Fox  MIT Press  647 pp.  \$55.00  ISBN 0-262-20162-3
183,A Framework for Collaborative  Content-Based and Demographic Filtering
184,Essentials of Game Theory
185,Security and Privacy in Communication Networks
186,Model-based reasoning
187,Expressiveness and tractability in knowledge representation and reasoning
188,Personalized Electronic Program Guides for Digital TV
189,L{\'o}gica para Computa{\c c}{\~a}o
190,A review of current defeasible reasoning implementations
191,Front Matter
192,Choosing Work Group Members: Balancing Similarity  Competence  and Familiarity
193,Living with CLASSIC: When and how to use a KL-ONE-like language
194,Frame Logic: uma linguagem orientada a objetos para codifica\\cc\\\{\textasciitilde}a\o e consultas dedutivas de ontologias
195,Machine Learning for Adaptive Power Management
196,Evolving populations of agents with personalities in the minority game
197,Model Driven Architecture: How to Re-model an E-learning Web-based System to Be Ready for the Semantic Web?
198,Connection strategies: Social capital implications of Facebook-enabled communication practices
199,Book Review: 'Digital Teaching Platforms: Customizing Classroom Learning For Each Student' edited by Chris Dede and John Richards. 
200,Sentiment Analysis in Social Networks
201,LNAI 4068 - Peirce{\textquoteright}s Contributions to the 21st Century
202,Anais dos Workshops do Congresso Brasileiro de Inform{\'a}tica na Educa{\c c}{\~a}o
203,2010 IEEE 14th International Conference on Intelligent Engineering Systems
204,Como escrever uma carta de apresenta{\c c}{\~a}o acad{\^e}mica | Viva Mundo
205,Individual Q-Learning in Normal Form Games
206,E agora  quem poder{\'a} me ajudar? Utilizando sistemas de recomenda{\c c}{\~a}o para otimiza{\c c}{\~a}o do processo de busca por aux{\'\i}lio em ambientes colaborativos de ensino
207,A Concise INtroduction to Multiagent Systems and Distributed Artificial Intelligence
208,Enhancing Recommendation Quality of Content-based Filtering through Collaborative Predictions and Fuzzy Similarity Measures
209,Spontaneous regression over time of the germinal epithelium in a Y chromosome-microdeleted patient: Case report
210,The semantic web: How RDF will change learning technology standards
211,On-line active learning: A new paradigm to improve practical useability of data stream modeling methods
212,Exploring user-based recommender results in large learning object repositories: the case of MERLOT
213,Reasoning and revision in hybrid representation systems
214,TRUSTe: an online privacy seal program
215,Agent-Based Intelligent Multimedia Broadcasting within MPEG-21 Multimedia Framework
216,Mining meaning from online ratings and reviews: Tourist satisfaction~analysis using latent dirichlet~allocation
217,www.paams.net/papers/articles/itel/3.pdf
218,Value creation: the future of knowledge management
219,Proceedings of the Workshop on Context-Aware Movie Recommendation - CAMRa '10
220,Complexidade de Algoritmos
221,Content availability  pollution and poisoning in file sharing peer-to-peer networks
222,The Internet and income inequality: Socio-economic challenges in a hyperconnected society
223,Logic programming and knowledge representation
224,Perfil de metadados OBAA utilizado no ensino de profissionais de sa{\'u}de
225,A Linked Data approach for the discovery of educational ICT tools in the Web of Data
226,www.paams.net/papers/articles/itel/7.pdf
227,The \$\backslash$TeX\ Book
228,Semantic Web languages for policy representation and reasoning: A comparison of KAoS  Rei  and Ponder
229,TORMES Methodology to Elicit Educational Oriented Recommendati
230,Microsoft Word - CPSv3.8_final.doc
231,Educational data mining: A survey from 1995 to 2005
232,Comparison of Collaborative Filtering Algorithms: Limitations of Current Techniques and Proposals for Scalable  High-Performance Recommender Syst
233,A personalized information recommendation system for R{\&}amp;D project opportunity finding in big data contexts
234,Intelligent Agents: The Key Concepts
235,Learning Optimal Subsets with Implicit User Preferences
236,Defining knowledge translation.
237,Web mining research: A survey
238,Ontology-Based Personalised and Context-Aware Recommendations of News Items
239,Medidas Est\\`E\ticas para Documentos Adaptativos
240,Lifestyle finder: Intelligent user profiling using large-scale demographic data
241,Applying data mining techniques for spatial distribution analysis of plant species co-occurrences
242,Adaptive neuro-fuzzy pedagogical recommender
243,Identifying hidden social circles for advanced privacy configuration
244,Empirical model-building and response surfaces.
245,Evaluating Recommender Systems for Technology Enhanced Learning: A Quantitative Survey
246,Foundations of neural networks  fuzzy systems  and knowledge engineering Nikola K. Kasabov. MIT Press  Cambridge  MA. (1996). 550 pages. \$60.00
247,The dilemma of the honest researcher
248,Engenharia de Sistemas Multiagentes: Uma Investiga\\cc\\\{\textasciitilde}a\o sobre o Estado da Arte
249,Trust Management Survey
250,International Encyclopedia of the Social and Behavioral Sciences
251,Development of intelligent systems and multi-agents systems with amine platform
252,The Behavior Markup Language: Recent Developments and Challenges
253,Uma Proposta para Editora\\cc\\\{\textasciitilde}a\o  Indexa\\cc\\\{\textasciitilde}a\o e Busca de Documentos Cient\\'\i\ficos em um Processo de Avalia\\cc\\\{\textasciitilde}a\o Aberta
254,Problem Solving and Reasoning: Case-Based
255,Software Engineering  9/E
256,A Density-Based Algorithm for Discovering Clusters in Large Spatial Databases with Noise
257,Learning materials recommendation using good learners{\textquoteright} ratings and content-based filtering
258,Secure Web 2.0 Content Sharing Beyond Walled Gardens
259,The Kardashian index: a measure of discrepant social media profile for scientists.
260,High performance XSL-FO rendering for variable data printing
261,Dataset-driven research for improving recommender systems for learning
262,Ontology-based web service to recommend spare time activities
263,Agent theories  architectures  and languages: A survey
264,Designing Ontology using Protege
265,Cloudmark: Anti-spam  Spam Filter  Anti-virus  Anti-phishing  and Spam-Blocking for Service Providers
266,A Aprendizagem Situada nas Comunidades de Pr{\'a}tica: Uma Aproxima{\c c}{\~a}o Fenomenol{\'o}gica
267,A constraints journal
268,Using institutional data to predict student course selections in higher education
269,Collaborative Filtering: The Aim of Recommender Systems and the Significance of User Ratings
270,www.paams.net/papers/articles/isami/20.pdf
271,L{\'o}gica para Computa{\c c}{\~a}o
272,TV program recommendiation for groups based on multidimensional TV-Anytime classifications
273,Making Industry-university partnerships work: Lessons from successful collaborations
274,Run the GAMUT: A comprehensive approach to evaluating game-theoretic algorithms
275,Towards Context Aware Emotional Intelligence in Machines: Computing Contextual Appropriateness of Affective States
276,School engagement: Potential of the concept  state of the evidence
277,IA Simb{\'o}lica versus IA Conexionista: Construindo Agentes Inteligentes
278,SINVLIO: Using semantics and fuzzy logic to provide individual investment portfolio recommendations
279,REST vs. SOAP at Amazon
280,Issues in knowledge level modelling
281,Graphic Design: Collaborative Processes = Understanding Self and Others.
282,LC-Lecture20
283,Game theory for wireless engineers
284,Shaping how advertisers see me: user views on implicit and explicit profile capture
285,Regras locais e a solu
286,Description of the RACER System and its Applications.
287,Content-based book recommending using learning for text categorization
288,New approaches to mood-based hybrid collaborative filtering
289,Towards a Sociological View of Trust in Computer Science
290,On the generalised distance in statistics
291,Intellectual capital: The new wealth of organizations
292,Human Factors in End-user Development of Marketing-IS: A Behavioral User Profiling Approach
293,PHP
294,Case amazon: ratings and reviews as part of recommendations
295,A data-oriented survey of context models
296,A critical evaluation of literature on visual aesthetics for the web
297,HermiT: A Highly-Efficient OWL Reasoner.
298,Advances in Artificial Intelligence
299,A Principal Component Analysis of 39 Scientific Impact Measures
300,Multiagent Systems: Algorithmic  Game-Theoretic  and Logical Foundations
301,A constraints journal
302,Equality
303,dataTEL challenge: Europen Schoolnet's Travel well dataset
304,Tutorial / HCI for recommender systems: a tutorial
305,Domain Ontology for Personalized E-Learning in Educational Systems
306,Print Preview - C:\DOCUME{\textasciitilde}1\TEMP\LOCALS{\textasciitilde}1\Temp\1\.aptcache\20TKDEindex\20TKDEindex
307,Lifelong Learning and its support with new technologies
308,What Makes a Good Semantic Web Application? - Cambridge Semantics
309,How consistent are human judgments of whether an open resource is educational material?
310,Learning to rank images for complex queries in concept-based search
311,Conexionismo
312,The Strongest Link: Libraries and Linked Data
313,WF2016_prelim_agenda_7_11.pdf
314,Knowledge Representation and Reasoning : Planning
315,An approach to design the student interaction based on the recommendation of e-learning objects
316,What do you recommend? Implementation and analyses of collaborative information filtering of web resources for education
317,Analysis of Open Technological Standards for Learning Objects
318,Standardization of Ontologies
319,Algorithms for clustering data
320,OWL 2: The next step for OWL
321,Projeto OBAA: Uma abordagem com objetos de aprendizagem interoper{\'a}veis baseados na web e na televis{\~a}o digital
322,Title
323,Algorithms for Reinforcement Learning
324,Advertisement Posting Based on Consumer Behaviour
325,Chapter 9 - Creating University Analytical Information Systems: A Grand Challenge for Information Systems Research
326,Partial local FriendQ multiagent learning: application to team automobile coordination problem
327,Data preparation for data mining
328,Towards an adaptive Web training environment based on cognitive style of learning: An empirical approach
329,The Epistemological Differences Between a Teacher and Researcher: A personal journey illustrating second order action research
330,Arquiteturas Pedag{\'o}gicas e Redes Sociais: Uma experi{\^e}ncia no Facebook
331,A non-authoritative educational metadata ontology for filtering and recommending learning objects
332,Optimal Set Recommendations Based on Regret
333,Using Recommendations for Managing Trust in Distributed Systems
334,Support for arbitrary regions in XSL-FO
335,FEB
336,Recommender systems and their impact on sales diversity
337,Situational reasoning for task-oriented mobile service recommendation
338,Do You Trust Your Recommendations? An Exploration of Security and Privacy Issues in Recommender Systems
339,Hybrid collaborative filtering for high-involvement products: A solution to opinion sparsity and dynamics
340,FEDERA{\c C}{\~A}O DE REPOSIT{\'O}RIOS EDUCA BRASIL - FEB
341,Introduction to Machine Learning (Adaptive Computation and Machine Learning)
342,Understanding the effects of professors' pedagogical development with Clicker Assessment and Feedback technologies and the impact on{\&}nbsp;students' engagement and learning in higher education
343,Determinants of behavioral intention to use the Personalized Location-based Mobile Tourism Application: An empirical study by integrating TAM with ISSM
344,Recommender: Helping viewers in their choice for educational programs in digital TV context
345,L{\'o}gica para Computa{\c c}{\~a}o
346,An architecture for making recommendations to courseware authors using association rule mining and collaborative filtering
347,Recommendation of similar users  resources and social networks in a Social Internetworking Scenario
348,Fourteen Steps to Writing an Effective Discussion Section
349,Brazilian Proposal for Agent-Based Learning Objects Metadata Standard-OBAA
350,https://circle.ubc.ca/bitstream/handle/2429/44812/Castagne_Michel_LIBR596_IR_comparison_2013.pdf?sequence=1
351,Possibilities of Describing Culturally-Aware Characteristics in Learning Objects Metadata
352,Ontologies and semantic web for e-learning
353,Basic description logics
354,data. europeana. eu: The Europeana Linked Open Data Pilot
355,MovieLens
356,An architecture for making recommendations to courseware authors using association rule mining and collaborative filtering
357,Web Usage Mining: Discovery and Applications of Usage Patterns from Web Data
